{
  "format": "axiom-garden/world",
  "schemaVersion": 1,
  "id": "world:minimal",
  "metadata": {
    "title": "Minimal world",
    "description": "",
    "createdAt": "2026-07-26T00:00:00.000Z",
    "updatedAt": "2026-07-26T00:00:00.000Z",
    "tags": []
  },
  "grid": {
    "kind": "square",
    "width": 1,
    "height": 1,
    "origin": "top-left",
    "boundary": "bounded"
  },
  "palette": {
    "symbols": []
  },
  "layers": [
    {
      "id": "layer:base",
      "name": "Base",
      "order": 0,
      "visible": true,
      "locked": false
    }
  ],
  "cells": [],
  "entities": []
}
